node_id,year,title,journal,source_title,doi,sap_rank,internal_indegree,internal_outdegree,is_top_fruit,year_score,citation_size_score,leaf_length,leaf_width,leaf_color,x,y,rotation
"RAHIMI A, 2026, J HOSP LEIS SPORT TO",2026.0,ENTREPRENEURIAL MARKETING EDUCATION AND INTENTIONS IN SPORT: INVESTIGATING THE MODERATING EFFECT OF SPORTING CAPITAL,JOURNAL OF HOSPITALITY LEISURE SPORT & TOURISM EDUCATION,J HOSP LEIS SPORT TO,10.1016/j.jhlste.2026.100598,5923013969,0,34,False,1.0,1.0,34.0,14.62,#BECC2D,308.474,280.0,-65.0
"CHOOSET N, 2025, COGENT BUS MANAG",2025.0,DEVELOPING ENTREPRENEURIAL MARKETING DIMENSIONS FOR SMES IN THE DIGITAL ERA: A GROUNDED THEORY APPROACH,COGENT BUSINESS & MANAGEMENT,COGENT BUS MANAG,10.1080/23311975.2025.2480748,135386595043,0,95,False,0.8571428571428571,1.0,34.0,14.62,#B5C42D,562.4627130565851,237.03846301314803,-18.0
"YANG M, 2025, INT BUS REV",2025.0,TURNING DECISION-MAKING LOGIC INTO INTERNATIONAL PERFORMANCE AMONG SMES: REVEALING THE IMPORTANCE OF INTERNATIONAL ENTREPRENEURIAL MARKETING,INTERNATIONAL BUSINESS REVIEW,INT BUS REV,10.1016/j.ibusrev.2025.102457,27257392934,0,97,False,0.8571428571428571,1.0,34.0,14.62,#B5C42D,1043.5238331388114,225.77763161150784,29.0
"CAPELI CMD, 2025, J SMALL BUS ENTERP D",2025.0,THE MUTUAL INFLUENCE BETWEEN ENTREPRENEURIAL MARKETING AND CAUSAL AND EFFECTUAL ENTREPRENEURSHIP: AN EMPIRICAL STUDY IN AN EMERGING AND DEVELOPING ECONOMY,JOURNAL OF SMALL BUSINESS AND ENTERPRISE DEVELOPMENT,J SMALL BUS ENTERP D,10.1108/JSBED-04-2024-0197,23717889800,0,41,False,0.8571428571428571,1.0,34.0,14.62,#B5C42D,302.96703065223977,334.85368381909825,-54.0
"ALIAKBARI A, 2025, INT J ENTREP BEHAV R",2025.0,UNPACKING THE RELATIONSHIP BETWEEN ENTREPRENEURIAL MARKETING ACTIVITIES AND SMALL FIRM PERFORMANCE,INTERNATIONAL JOURNAL OF ENTREPRENEURIAL BEHAVIOR & RESEARCH,INT J ENTREP BEHAV R,10.1108/IJEBR-10-2024-1173,4257569970,0,61,False,0.8571428571428571,1.0,34.0,14.62,#B5C42D,486.3206898192868,179.15919701754208,-7.0
"CRICK JM, 2025, J STRATEG MARK",2025.0,MANAGING AN ENTREPRENEURIAL MARKETING ORIENTATION IN TURBULENT COMPETITIVE BUSINESS ENVIRONMENTS,JOURNAL OF STRATEGIC MARKETING,J STRATEG MARK,10.1080/0965254X.2024.2445655,2452735063,0,45,False,0.8571428571428571,1.0,34.0,14.62,#B5C42D,1109.2040591961604,256.66075862679577,40.0
"ROBLEDO S, 2025, J RES MARK ENTREP",2025.0,EXAMINING THE ROLE OF MONETARY INCENTIVES AND TIE STRENGTH IN MEDIATING SATISFACTION AND WORD OF MOUTH IN MULTILEVEL MARKETING COMPANIES: AN ENTREPRENEURIAL MARKETING PERSPECTIVE,JOURNAL OF RESEARCH IN MARKETING AND ENTREPRENEURSHIP,J RES MARK ENTREP,10.1108/JRME-07-2023-0117,930078481,0,48,False,0.8571428571428571,1.0,34.0,14.62,#B5C42D,201.64497995414573,340.02884910775543,-43.0
"ALFORD P, 2025, INT J ENTREP BEHAV R",2025.0,DIGITAL ENTREPRENEURIAL MARKETING BRICOLAGE: SHAPING TECHNOLOGY-IN-PRACTICE,INTERNATIONAL JOURNAL OF ENTREPRENEURIAL BEHAVIOR & RESEARCH,INT J ENTREP BEHAV R,10.1108/IJEBR-07-2024-0746,603052032,0,25,False,0.8571428571428571,1.0,34.0,14.62,#B5C42D,1159.77944132207,312.01429166452596,51.0
"GOYAL A, 2025, TOUR HOSP MANAG-CROA",2025.0,INFLUENCE OF ENTREPRENEURIAL MARKETING ON HOTEL INDUSTRY PERFORMANCE: A MEDIATION ANALYSIS,TOURISM AND HOSPITALITY MANAGEMENT-CROATIA,TOUR HOSP MANAG-CROA,10.20867/thm.31.3.6,600156252,0,53,False,0.8571428571428571,1.0,34.0,14.62,#B5C42D,83.29619291578786,314.1019862131981,-32.0
"TIAN HY, 2025, J COMPETITIVENESS",2025.0,DATA-DRIVEN DISRUPTIVE COMPETITIVENESS: EXPLORING THE ROLE OF BIG DATA ANALYTICS CAPABILITY AND ENTREPRENEURIAL MARKETING IN DISRUPTIVE INNOVATION,JOURNAL OF COMPETITIVENESS,J COMPETITIVENESS,10.7441/joc.2025.01.12,233605618,0,29,False,0.8571428571428571,1.0,34.0,14.62,#B5C42D,694.1433579349574,129.1241346192637,15.0
"ROY J, 2025, ARCH TECH SCI",2025.0,ENTREPRENEURIAL MARKETING AND INNOVATION CAPABILITIES IN HIGH TECHNOLOGY STARTUPS IN EMERGING ECONOMIES,ARCHIVES FOR TECHNICAL SCIENCES,ARCH TECH SCI,10.70102/afts.2025.1834.341,203010454,0,4,False,0.8571428571428571,1.0,34.0,14.62,#B5C42D,1070.8670772651774,352.0777374555262,62.0
"CORREA V, 2025",2025.0,THE INFLUENCE OF CAUSAL AND EFFECTUAL ENTREPRENEURSHIP ON THE DIMENSIONS OF ENTREPRENEURIAL MARKETING: AN EXPLORATORY STUDY OF WOMEN ENTREPRENEURS IN BRAZIL,INTERNATIONAL JOURNAL OF GENDER AND ENTREPRENEURSHIP,,10.1108/IJGE-04-2025-0140,182528459,0,30,False,0.8571428571428571,1.0,34.0,14.62,#B5C42D,104.91987549116367,239.54242581714223,-21.0
"KHASMAFKAN-NEZAM MH, 2025, SOC RESPONSIB J",2025.0,"THE INTERSECTION OF RESPONSIBLE LEADERSHIP AND ENTREPRENEURIAL MARKETING: THE ROLES OF ETHICAL CLIMATE, EFFECTIVE KNOWLEDGE TRANSFER AND PERSON-ORGANIZATION FIT",SOCIAL RESPONSIBILITY JOURNAL,SOC RESPONSIB J,10.1108/SRJ-01-2025-0008,165791051,0,33,False,0.8571428571428571,1.0,34.0,14.62,#B5C42D,825.2070264908389,172.0228727117232,26.0
"MIRZAYI S, 2025",2025.0,HOW GENERATIVE AI IS RESHAPING ENTREPRENEURIAL MARKETING,JOURNAL OF MARKETING THEORY AND PRACTICE,,10.1080/10696679.2025.2571634,35725390,0,24,False,0.8571428571428571,1.0,34.0,14.62,#B5C42D,935.6325897379102,367.17437182194476,-57.0
"NEILL S, 2025, J RES MARK ENTREP",2025.0,THE INTEGRATION OF ENTREPRENEURIAL MARKETING PROCESSES AND CONTROLS,JOURNAL OF RESEARCH IN MARKETING AND ENTREPRENEURSHIP,J RES MARK ENTREP,10.1108/JRME-06-2024-0138,25471853,0,27,False,0.8571428571428571,1.0,34.0,14.62,#B5C42D,213.82962677860678,210.88191072811847,-10.0
"LU H, 2025",2025.0,EXPLORE THE IMPORTANCE OF COMPETITIVE STRATEGY TO ENTREPRENEURIAL MARKETING AND BUSINESS PERFORMANCE,JOURNAL OF THE INTERNATIONAL COUNCIL FOR SMALL BUSINESS,,10.1080/26437015.2025.2513961,17189534,0,21,False,0.8571428571428571,1.0,34.0,14.62,#B5C42D,768.9267039931696,255.85126090294028,37.0
"SAXENA G, 2025",2025.0,IDENTITY WORK AND ENTREPRENEURIAL MARKETING AMONG WOMEN ENTREPRENEURS IN VIETNAM: A POSTCOLONIAL FEMINIST PERSPECTIVE,"GENDER, WORK AND ORGANIZATION",,10.1111/GWAO.70087,6446785,0,7,False,0.8571428571428571,1.0,34.0,14.62,#B5C42D,878.8005000347783,288.72686926101636,-46.0
"ISTREFI A, 2025, INT J TECHNOL ENHANC",2025.0,THE ROLE OF ENTREPRENEURIAL MARKETING AND DIGITAL TRANSFORMATION ON WOMEN'S ENTREPRENEURIAL INTENTIONS IN KOSOVO,INTERNATIONAL JOURNAL OF TECHNOLOGY ENHANCED LEARNING,INT J TECHNOL ENHANC,10.1504/IJTEL.2025.145315,1389665,0,13,False,0.8571428571428571,1.0,34.0,14.62,#B5C42D,360.7790248931582,208.3898272402597,1.0
"EGGERS F, 2025, J RES MARK ENTREP",2025.0,"ENTREPRENEURIAL MARKETING, TECHNOLOGY, AND TRANSFORMATIVE CHANGE: EDITORIAL AND INTRODUCTION TO THE SPECIAL ISSUE",JOURNAL OF RESEARCH IN MARKETING AND ENTREPRENEURSHIP,J RES MARK ENTREP,10.1108/JRME-03-2025-216,334258,0,5,False,0.8571428571428571,1.0,34.0,14.62,#B5C42D,628.9094378094877,328.4314239488294,48.0
"SARABDEEN J, 2025",2025.0,SAUDI ARABIAN LEGAL FRAMEWORK ON THE USE OF SOCIAL MEDIA IN ENTREPRENEURIAL MARKETING,SOCIAL SCIENCES AND HUMANITIES OPEN,,10.1016/J.SSAHO.2025.102242,131270,0,24,False,0.8571428571428571,1.0,34.0,14.62,#B5C42D,948.3120508719721,225.45837586340699,-35.0
"QUINTERO-ARANGO LF, 2024, CLIO AM",2024.0,ENTREPRENEURIAL MARKETING IN ACTION: MULTIDIMENSIONAL IMPACT AND SECTORAL APPLICATIONS,CLIO AMERICA,CLIO AM,10.21676/23897848.5683,17974524032,0,39,False,0.7142857142857143,1.0,34.0,14.62,#ABBC2D,390.8693964023948,291.8412108990832,12.0
"YADAV A, 2024, J ORGAN CHANGE MANAG",2024.0,DEVELOPING AND VALIDATING A SCALE FOR ENTREPRENEURIAL MARKETING ORIENTATIONS: EMICO FRAMEWORK AND ITS IMPACT ON BUSINESS PERFORMANCE IN STARTUPS,JOURNAL OF ORGANIZATIONAL CHANGE MANAGEMENT,J ORGAN CHANGE MANAG,10.1108/JOCM-11-2023-0461,11326951539,0,60,False,0.7142857142857143,1.0,34.0,14.62,#ABBC2D,463.54583166964267,262.9075788973688,59.0
"WIJEKOON S, 2024, EUR J MARKETING",2024.0,THE IMPACT OF ENTREPRENEURIAL MARKETING ON NEW VENTURE BRAND IMAGE AND PERFORMANCE: A CAPABILITY PERSPECTIVE,EUROPEAN JOURNAL OF MARKETING,EUR J MARKETING,10.1108/EJM-07-2022-0568,2071072188,0,65,False,0.7142857142857143,1.0,34.0,14.62,#ABBC2D,343.86735123479997,388.1573931449338,23.0
"ABAIDAH TNABT, 2024, UCJC BUS SOC REV",2024.0,THE MODEL OF ENTREPRENEURIAL MARKETING (EM) AMONG AGROPRENEURS IN THE EMERGING MARKETS: A CONCEPTUAL FRAMEWORK,UCJC BUSINESS AND SOCIETY REVIEW,UCJC BUS SOC REV,10.3232/UBR.2024.V21.N1.05,2061178623,0,34,False,0.7142857142857143,1.0,34.0,14.62,#ABBC2D,464.3825176138772,164.16822983387206,-60.0
"SALIH ES, 2024, J DEV ENTREP",2024.0,EXPLORING THE IMPACT OF ENTREPRENEURIAL MARKETING ON SHARED VALUE CREATION: THE MEDIATING ROLE OF ORGANIZATIONAL AMBIDEXTERITY,JOURNAL OF DEVELOPMENTAL ENTREPRENEURSHIP,J DEV ENTREP,10.1142/S1084946724500249,1079849963,0,22,False,0.7142857142857143,1.0,34.0,14.62,#ABBC2D,1191.9915814128258,243.8756190159895,-13.0
"TOLOSSA AT, 2024, BUS STRATEGY DEV",2024.0,LINKING BUSINESS SUSTAINABLE DEVELOPMENT WITH ENTREPRENEURIAL MARKETING PRACTICES: EVIDENCE FROM SMALL AND MEDIUM ENTERPRISES IN ETHIOPIA,BUSINESS STRATEGY AND DEVELOPMENT,BUS STRATEGY DEV,10.1002/bsd2.412,980196951,0,40,False,0.7142857142857143,1.0,34.0,14.62,#ABBC2D,151.47479424285285,381.6639295846214,34.0
"LOTFABADI VT, 2024, INTERD J MANAGE STUD",2024.0,HOW ENTREPRENEURIAL MARKETING LEADS TO CUSTOMER SATISFACTION (THE MEDIATION EFFECT OF CUSTOMER VALUE),INTERDISCIPLINARY JOURNAL OF MANAGEMENT STUDIES,INTERD J MANAGE STUD,10.22059/ijms.2023.347747.675310,391413146,0,39,False,0.7142857142857143,1.0,34.0,14.62,#ABBC2D,549.699233435554,57.46584452055413,-49.0
"CHEN YH, 2024, SUSTAINABILITY-BASEL",2024.0,THE INNOVATIVE ENTREPRENEURIAL MARKETING JOURNEY AND SUSTAINABLE DEVELOPMENT OF SOUTHEAST ASIAN IMMIGRANTS,SUSTAINABILITY,SUSTAINABILITY-BASEL,10.3390/su16072815,180151157,0,42,False,0.7142857142857143,1.0,34.0,14.62,#ABBC2D,1250.1798180131375,348.8296571754551,-2.0
"HANOUN D, 2024",2024.0,THE MODERATING ROLE OF TECHNOLOGICAL TURBULENCE IN THE EFFECT OF ENTREPRENEURIAL MARKETING ON SMES' PERFORMANCE,WSEAS TRANSACTIONS ON BUSINESS AND ECONOMICS,,10.37394/23207.2024.21.214,69773358,0,57,False,0.7142857142857143,1.0,34.0,14.62,#ABBC2D,62.53626777341728,303.82101997468357,45.0
"ENTSMINGER JS, 2024, J RES MARK ENTREP",2024.0,"ENTREPRENEURIAL MARKETING STRATEGIES, RESOURCES AND SOCIAL DISADVANTAGE: EXPLORING THE ROLE OF RESOURCES AND MINORITY STATUS AMONG US AGROFOOD ENTERPRISES",JOURNAL OF RESEARCH IN MARKETING AND ENTREPRENEURSHIP,J RES MARK ENTREP,10.1108/JRME-03-2023-0033,45603620,0,30,False,0.7142857142857143,1.0,34.0,14.62,#ABBC2D,765.5089636297741,88.50155089382565,-38.0
"NWANKWO CA, 2024, FOUND MANAGE",2024.0,ACHIEVING SURVIVAL OF SOCIAL ENTERPRISE THROUGH ENTREPRENEURIAL MARKETING: AN EMPIRICAL ANALYSIS OF NIGERIA,FOUNDATIONS OF MANAGEMENT,FOUND MANAGE,10.2478/fman-2024-0016,2898270,0,22,False,0.7142857142857143,1.0,34.0,14.62,#ABBC2D,1071.444338211602,404.2024504706842,9.0
"TOLOSSA A, 2024, J INNOV ENTREPRENEURSHIP",2024.0,UNVEILING THE NEXUS: THE CRUCIAL ROLE OF COMPETITIVE ADVANTAGE IN BRIDGING ENTREPRENEURIAL MARKETING PRACTICES AND SUSTAINABLE FIRM PERFORMANCE IN SMALL AND MEDIUM ENTERPRISES,JOURNAL OF INNOVATION AND ENTREPRENEURSHIP,J INNOV ENTREPRENEURSHIP,10.1186/S13731-024-00398-0,1803313,0,42,False,0.7142857142857143,1.0,34.0,14.62,#ABBC2D,33.07552830585513,198.00038185384457,56.0
"SUANDI E, 2023, J FINANC SERV MARK",2023.0,"EVALUATING THE RELATIONSHIP BETWEEN ENTREPRENEURIAL MARKETING, COMPETITIVE ADVANTAGE, AND ISLAMIC BANKS PERFORMANCE",JOURNAL OF FINANCIAL SERVICES MARKETING,J FINANC SERV MARK,10.1057/s41264-022-00169-6,3124156404,0,39,False,0.5714285714285714,1.0,34.0,14.62,#A2B42D,963.0282968018354,180.45169637042926,-27.0
"CHOU WC, 2023, NTU MANAG REV",2023.0,HOW ENTREPRENEURIAL MARKETING FACILITATES DIRECT SELLERS' ENTREPRENEURIAL PROCESS: A DYNAMIC ADJUSTMENT PERSPECTIVE,NTU MANAGEMENT REVIEW,NTU MANAG REV,10.6226/NTUMR.202308_33(2).0004,760388225,0,51,False,0.5714285714285714,1.0,34.0,14.62,#A2B42D,910.962766072025,360.0948388716511,20.0
"MARIN A, 2023, J MARKET EDUC",2023.0,"FROM LAB TO MARKET: LEARNING ENTREPRENEURIAL MARKETING THROUGH MULTI-SEMESTER, STAGE-GATE, CAPSTONE PROJECT IN STEM MBA",JOURNAL OF MARKETING EDUCATION,J MARKET EDUC,10.1177/02734753231185415,327538038,0,44,False,0.5714285714285714,1.0,34.0,14.62,#A2B42D,231.05084242441654,164.5613735872512,-63.0
"SARFRAZ M, 2023, IND TEXTILA",2023.0,THE EFFECT OF ENTREPRENEURS' PERSONALITY ON ENTREPRENEURIAL MARKETING IN TEXTILE SECTOR: THE MEDIATING ROLE OF SELF-EFFICACY,INDUSTRIA TEXTILA,IND TEXTILA,10.35530/IT.074.02.202179,218717480,0,39,False,0.5714285714285714,1.0,34.0,14.62,#A2B42D,831.674063480345,309.48309148181386,-16.0
"LI LY, 2023, SUSTAINABILITY-BASEL",2023.0,"SUSTAINABLE MICRO, SMALL, AND MEDIUM ENTERPRISES: A DEVELOPED MODEL OF ENTREPRENEURIAL MARKETING BEHAVIORS FOR THAILAND'S MSMES",SUSTAINABILITY,SUSTAINABILITY-BASEL,10.3390/su151713135,148084865,0,39,False,0.5714285714285714,1.0,34.0,14.62,#A2B42D,774.1279889559459,271.5034284601857,31.0
"ALKUFAHY A, 2023",2023.0,THE MODERATING ROLE OF SOCIAL MEDIA MARKETING ON THE RELATIONSHIP BETWEEN ENTREPRENEURIAL MARKETING STRATEGY AND BUSINESS OUTCOMES: AN EMPIRICAL STUDY IN SMES IN JORDAN,JOURNAL OF SYSTEM AND MANAGEMENT SCIENCES,,10.33168/JSMS.2023.0418,64049800,0,23,False,0.5714285714285714,1.0,34.0,14.62,#A2B42D,468.44289368747013,183.30905282269626,-52.0
"BASHA M, 2023",2023.0,ENTREPRENEURIAL MARKETING STRATEGY AND CUSTOMER LOYALTY: AN EMPIRICAL EVIDENCE FROM COFFEE SHOPS,CORPORATE AND BUSINESS STRATEGY REVIEW,,10.22495/CBSRV4I1ART16,41359658,0,16,False,0.5714285714285714,1.0,34.0,14.62,#A2B42D,596.8769566488053,323.0503141935176,-5.0
"MAKMUR, 2023, J DISTRIB SCI",2023.0,THE EFFECT OF ENTREPRENEURIAL MARKETING ON VILLAGE-OWNED ENTERPRISES PERFORMANCE DISTRIBUTION,JOURNAL OF DISTRIBUTION SCIENCE,J DISTRIB SCI,10.15722/jds.21.09.202309.55,22953290,0,49,False,0.5714285714285714,1.0,34.0,14.62,#A2B42D,914.6135529246984,178.5274661379218,42.0
"RIBEIRO AMS, 2023, REV ELETRONICA ESTRA",2023.0,ENTREPRENEURIAL MARKETING OF STARTUPS: CONSTRUCTIVIST BIBLIOGRAPHIC RESEARCH BASED ON PROKNOW-C,REVISTA ELETRONICA DE ESTRATEGIA E NEGOCIOS-REEN,REV ELETRONICA ESTRA,,13518257,0,26,False,0.5714285714285714,1.0,34.0,14.62,#A2B42D,482.9101460806621,316.93181596516644,-41.0
"NWANKWO CA, 2023, FOUND MANAGE",2023.0,CRITICAL UNDERSTANDING OF EXISTING ENTREPRENEURIAL MARKETING MODELS: 2002 - 2022,FOUNDATIONS OF MANAGEMENT,FOUND MANAGE,10.2478/fman-2023-0007,418661,0,37,False,0.5714285714285714,1.0,34.0,14.62,#A2B42D,333.9657117944542,279.6074230026133,6.0
"AL-TATE ADS, 2022, J ASIAN FINANC ECON",2022.0,THE IMPACT OF MARKETING CULTURE AND RATIONAL DECISION ON ACADEMIC ENTREPRENEURSHIP AND ENTREPRENEURIAL MARKETING: FIELD RESEARCH FOR IRAQI PRIVATE COLLEGES,JOURNAL OF ASIAN FINANCE ECONOMICS AND BUSINESS,J ASIAN FINANC ECON,10.13106/jafeb.2022.vol9.no4.0131,14525,0,6,False,0.42857142857142855,1.0,34.0,14.62,#99AB2D,313.1526180234589,388.56497633705396,-30.0
"ANTUNES H, 2020, INT J MARKET COMMUN",2020.0,ENTREPRENEURIAL MARKETING: CONCEPTUAL SYSTEMATIZATION IN ENGLISH AND PORTUGUESE LANGUAGES,INTERNATIONAL JOURNAL OF MARKETING COMMUNICATION AND NEW MEDIA,INT J MARKET COMMUN,,10367494,0,53,False,0.14285714285714285,1.0,34.0,14.62,#869B2D,372.9525196792196,126.99070404423529,17.0
"HAKEMZADEH F, 2020, INT J NONLINEAR ANAL",2020.0,PROVIDING A QUANTITATIVE MODEL FOR MANAGEMENT OF ENTREPRENEURIAL MARKETING IN THE MICROELECTRONICS INDUSTRY,INTERNATIONAL JOURNAL OF NONLINEAR ANALYSIS AND APPLICATIONS,INT J NONLINEAR ANAL,10.22075/IJNAA.2020.4749,105747,0,9,False,0.14285714285714285,1.0,34.0,14.62,#869B2D,1296.8407588000048,240.30528654476058,64.0
"ZAINUALDIN A, 2019",2019.0,EXAMINING ENTREPRENEURIAL MARKETING BEHAVIOURS IN SOCIAL ENTERPRISES,HUMANITIES AND SOCIAL SCIENCES REVIEWS,,10.18510/HSSR.2019.7249,142609,0,57,False,0.0,1.0,34.0,14.62,#7D932D,71.41155965469682,423.4934000847298,-19.0
"RIZVANDI A, 2019, J HUM SPORT EXERC",2019.0,ENTREPRENEURIAL MARKETING EFFECTS ON SPORT CLUB MANAGER PERFORMANCE (CONCEPTUAL MODEL),JOURNAL OF HUMAN SPORT AND EXERCISE,J HUM SPORT EXERC,10.14198/jhse.2019.14.Proc5.47,132184,0,29,False,0.0,1.0,34.0,14.62,#7D932D,554.3037203855964,-18.956541193048565,28.0
"KAKEESH DF, 2025, J MARK ANAL",2025.0,ENTREPRENEURIAL MARKETING AND BUSINESS PERFORMANCE IN SMES: THE MEDIATING ROLE OF COMPETITIVE AGGRESSIVENESS,JOURNAL OF MARKETING ANALYTICS,J MARK ANAL,10.1057/s41270-024-00310-5,690118043,0,52,True,0.8571428571428571,1.0,34.0,14.62,#B5C42D,573.3307199045139,121.13766746843058,4.0
"SULAIMAN MABA, 2024, DISCOV SUSTAIN",2024.0,ENTREPRENEURIAL MARKETING AND PERFORMANCE: CONTINGENT ROLE OF MARKET TURBULENCE,DISCOVER SUSTAINABILITY,DISCOV SUSTAIN,10.1007/s43621-024-00710-8,10757871610,0,49,True,0.7142857142857143,1.0,34.0,14.62,#ABBC2D,1078.3289106410923,175.243121720641,-24.0
"HANAYSHA JR, 2022, SUSTAINABILITY-BASEL",2022.0,AN EXAMINATION OF ENTREPRENEURIAL MARKETING DIMENSIONS AND FIRM PERFORMANCE IN SMALL AND MEDIUM ENTERPRISES,SUSTAINABILITY,SUSTAINABILITY-BASEL,10.3390/su141811444,23852561,0,85,True,0.42857142857142855,1.0,34.0,14.62,#99AB2D,1143.9444901662198,121.89809685162075,53.0
