leaf_rank,frontier_rank,leaf_type,target_leaves,node_id,title,abstract,year,journal,source_title,doi,cited_by,has_article_metadata,leaf_connection_score,sap_rank,internal_indegree,internal_outdegree,has_title_abstract
15,,sap_leaf,100,"ROBLEDO S, 2025, J RES MARK ENTREP",EXAMINING THE ROLE OF MONETARY INCENTIVES AND TIE STRENGTH IN MEDIATING SATISFACTION AND WORD OF MOUTH IN MULTILEVEL MARKETING COMPANIES: AN ENTREPRENEURIAL MARKETING PERSPECTIVE,"PURPOSETHIS STUDY AIMS TO EXPLORE THE MEDIATING ROLES OF MONETARY INCENTIVES AND TIE STRENGTH IN THE RELATIONSHIP BETWEEN SATISFACTION AND THE WORD-OF-MOUTH (WOM) PROCESS WITHIN A MULTILEVEL MARKETING (MLM) ORGANIZATION.DESIGN/METHODOLOGY/APPROACHTHIS STUDY CONDUCTED A PERSONAL SURVEY WITH 240 DISTRIBUTORS FROM A MLM COMPANY. THE CONCEPTUAL FRAMEWORK WAS TESTED USING STRUCTURAL EQUATION MODELING.FINDINGSTHESE EMPIRICAL FINDINGS SUBSTANTIATE THE VITAL ROLE OF SATISFACTION IN GENERATING WOM. MOREOVER, MONETARY INCENTIVES AND A STRONG INTERPERSONAL CONNECTION BETWEEN THE INFORMATION PROVIDER AND RECIPIENT (TIE STRENGTH) SERVE AS PIVOTAL DRIVERS IN INITIATING THE WOM PROCESS. THESE FACTORS WERE FOUND TO MEDIATE THE RELATIONSHIP BETWEEN SATISFACTION AND WOM, UNDERSCORING THEIR STRATEGIC IMPORTANCE.RESEARCH LIMITATIONS/IMPLICATIONSTHIS RESEARCH FOCUSES ON A SINGLE MLM COMPANY, LIMITING ITS GENERALIZABILITY TO NON-MLM OR OTHER COMPANIES. THIS AREA HOLDS PROMISE FOR FUTURE RESEARCH.PRACTICAL IMPLICATIONSMLM ENTREPRENEURS SHOULD PRIORITIZE OFFERING HIGH-QUALITY PRODUCTS, WELL-DESIGNED MONETARY INCENTIVES, AND FOSTERING STRONG RELATIONSHIPS WITH CLIENTS TO ACTIVATE THE WOM PROCESS.ORIGINALITY/VALUETHE RESULTS OF THIS STUDY INDICATE THAT SATISFACTION PLAYS A SIGNIFICANT ROLE IN WOM. IN ADDITION, THIS STUDY EMPHASIZES THE IMPORTANCE OF A WELL-STRUCTURED COMPENSATION PLAN (MONETARY INCENTIVES) AND THE NEED FOR MLM ENTREPRENEURS TO STRENGTHEN RELATIONSHIPS WITH CUSTOMERS TO ENHANCE THE LIKELIHOOD OF WOM ACTIVATION.",2025.0,JOURNAL OF RESEARCH IN MARKETING AND ENTREPRENEURSHIP,J RES MARK ENTREP,10.1108/JRME-07-2023-0117,0.0,True,30455,930078481,0,48,
16,,sap_leaf,100,"CHOU WC, 2023, NTU MANAG REV",HOW ENTREPRENEURIAL MARKETING FACILITATES DIRECT SELLERS' ENTREPRENEURIAL PROCESS: A DYNAMIC ADJUSTMENT PERSPECTIVE,"THIS STUDY INTENDS TO EXAMINE THE ENTREPRENEURIAL PROCESS OF INDIVIDUAL DIRECT SELLERS FROM THE PERSPECTIVE OF ENTREPRENEURIAL MARKETING, AND ADOPTS THE PROCESS METHOD WHERE EVENTS IN CHRONOLOGICAL ORDER ARE SCRUTINIZED. THIS STUDY COLLECTS DATA FROM TRIANGULAR SOURCES AND COMBINES THE FOCUS GROUP INTERVIEWS WITH IN-DEPTH INTERVIEWS TO EXAMINE 14 DIRECT SELLERS SELECTED FROM ONE DOMESTIC, AND ONE FOREIGN DIRECT SELLING BRAND, RESPECTIVELY. WE DEVELOP A DYNAMIC MODEL OF ENTREPRENEURIAL MARKETING. THE RESULTS SHOW THAT TWO RELATIONAL MANAGEMENT MECHANISMS ARE CRUCIAL TO THE SUCCESSFUL TRANSFORMATION TOWARDS THE NEXT ENTREPRENEURIAL PHASE. THE FINDINGS NOT ONLY FILL THE ACADEMIC GAP IN INDIVIDUAL-LEVEL DIRECT-SELLING STRATEGY, BUT ALSO SHED LIGHT ON ENTREPRENEURIAL MARKETING THEORY BY PROVIDING INSIGHTS REGARDING HOW RESOURCES AND INITIATIVES ARE MODIFIED, WHICH DEEPENS THE UNDERSTANDING OF ITS DYNAMICITY. MOREOVER, THIS RESEARCH EXTENDS THE TRANSACTION ORIENTED WESTERN STUDIES ON DIRECT SELLING TO THE 'QUANXI' (RELATIONSHIP) ORIENTED EASTERN CONTEXT THAT ESPECIALLY VALUES RELATIONAL NETWORK. IN PRACTICES, THE FINDINGS COULD ASSIST DIRECT SELLERS AND INTERPERSONAL-ORIENTED MICRO-ENTREPRENEURS TO DEVELOP PERSONAL BUSINESS TACTICS, AND SERVE AS REFERENCES FOR DIRECT SELLING COMPANIES TO PLAN FOR TRAINING PROGRAM OF BRAND AFFILIATES (BA) AND BRAND REPRESENTATIVES (BR).",2023.0,NTU MANAGEMENT REVIEW,NTU MANAG REV,10.6226/NTUMR.202308_33(2).0004,0.0,True,27533,760388225,0,51,
17,,sap_leaf,100,"KAKEESH DF, 2025, J MARK ANAL",ENTREPRENEURIAL MARKETING AND BUSINESS PERFORMANCE IN SMES: THE MEDIATING ROLE OF COMPETITIVE AGGRESSIVENESS,"THIS STUDY EXAMINES THE INTERPLAY BETWEEN ENTREPRENEURIAL MARKETING ORIENTATION AND BUSINESS PERFORMANCE AMONG SMES IN THE SERVICES SECTOR, WITH A PARTICULAR FOCUS ON COMPETITIVE AGGRESSIVENESS AS A MEDIATING FACTOR. DRAWING FROM A SAMPLE OF 320 SERVICE-BASED COMPANIES VIA BOTH ONLINE AND PAPER-BASED SURVEYS, THE RESEARCH EMPLOYS STRUCTURAL EQUATION MODELLING USING AMOS SOFTWARE TO ANALYSE THE DATA. THE RESULTS UNDERSCORE A SIGNIFICANT POSITIVE RELATIONSHIP BETWEEN ENTREPRENEURIAL MARKETING ORIENTATION AND BUSINESS PERFORMANCE AMONG SERVICE-BASED SMES IN JORDAN. BY DELVING INTO THE UNIQUE MARKETING CHALLENGES AND OPPORTUNITIES FACED BY THESE ENTERPRISES, THIS RESEARCH NOT ONLY OFFERS ACTIONABLE INSIGHTS FOR PRACTITIONERS BUT ALSO ENRICHES THE ENTREPRENEURIAL MARKETING DISCOURSE. THIS EXPLORATION DELVES INTO THE DOMAIN OF ENTREPRENEURIAL MARKETING ORIENTATION, EMPHASIZING ITS CRITICAL ROLE IN ENHANCING SME COMPETITIVENESS AND GROWTH WITHIN A DEVELOPING ECONOMY. INCORPORATING MARKETING ANALYTICS, THE STUDY OFFERS A DETAILED UNDERSTANDING THAT ENRICHES ACADEMIC LITERATURE AND INFORMS POLICY DEVELOPMENT FOR SUSTAINABLE ECONOMIC PROGRESS.",2025.0,JOURNAL OF MARKETING ANALYTICS,J MARK ANAL,10.1057/s41270-024-00310-5,8.0,True,26228,690118043,0,52,
18,,sap_leaf,100,"ALFORD P, 2025, INT J ENTREP BEHAV R",DIGITAL ENTREPRENEURIAL MARKETING BRICOLAGE: SHAPING TECHNOLOGY-IN-PRACTICE,"PURPOSE THE USE OF DIGITAL MARKETING TECHNOLOGIES REMAINS LOW IN SMALL MEDIUM ENTERPRISES (SMES), WITH DIGITAL TRANSFORMATION BEING A CONCERN FOR GOVERNMENTS GLOBALLY. THIS STUDY REPORTS ON THE HUMAN-TECHNOLOGY INTERACTION PROCESS, USING DIGITAL ENTREPRENEURIAL MARKETING (DEM) BRICOLAGE AND A SOCIOMATERIALITY LENS TO EXAMINE MORE DEEPLY ORGANISATIONAL INTERACTION BETWEEN MARKETERS AND DIGITAL MARKETING TECHNOLOGIES IN THESE FIRMS.DESIGN/METHODOLOGY/APPROACH A QUALITATIVE CASE STUDY AND PURPOSIVE SAMPLING APPROACH ARE DEPLOYED, USING SEVEN SMES IN THE SAME UK REGION. A BRICOLAGE AND SOCIOMATERIALITY FRAMEWORK AND TEMPLATE ANALYSIS ARE USED TO IDENTIFY DIGITAL MARKETING STRATEGIES AND CHALLENGES, LEVELS OF DIGITAL MARKETING BRICOLAGE AND ASSESS THE VALUE FOR EACH FIRM.FINDINGS FIRMS PRACTICE DIFFERENT LEVELS OF DEM BRICOLAGE DEPENDING ON THE INTERACTIONS OF THE MARKETERS WITH DIGITAL MARKETING TOOLS. THOSE MARKETERS IN FIRMS WHO HAD HIGHER LEVELS OF INTERACTION BETWEEN THE HUMAN AND THE TECHNOLOGICAL PROVIDED GREATER LONG-TERM STRATEGIC VALUE FOR THE SME.ORIGINALITY/VALUE THIS IS THE FIRST STUDY TO APPLY A SOCIOMATERIALITY LENS TO BRICOLAGE IN AN SME DIGITAL MARKETING CONTEXT AND ALLOWS US TO VIEW THE WAY IN WHICH EMPLOYEES INTERACT WITH DIGITAL MARKETING TECHNOLOGY AND CREATE VALUE. THERE IS SCARCE EMPIRICAL DATA IN THIS AREA DESPITE NUMEROUS CALLS IN THE DEVELOPING FIELD OF ENTREPRENEURSHIP AND DIGITALISATION IN SMALL AND GROWING FIRMS.",2025.0,INTERNATIONAL JOURNAL OF ENTREPRENEURIAL BEHAVIOR & RESEARCH,INT J ENTREP BEHAV R,10.1108/IJEBR-07-2024-0746,5.0,True,24515,603052032,0,25,
19,,sap_leaf,100,"GOYAL A, 2025, TOUR HOSP MANAG-CROA",INFLUENCE OF ENTREPRENEURIAL MARKETING ON HOTEL INDUSTRY PERFORMANCE: A MEDIATION ANALYSIS,"PURPOSE - THROUGH MARKETING COMPETENCE AS A MEDIATING FACTOR, THIS RESEARCH SEEKS TO EXAMINE THE EFFECTS OF ENTREPRENEURIAL MARKETING PERSPECTIVE ON THE FINANCIAL PERFORMANCE OF THE HOTEL INDUSTRY. METHODOLOGY - A SAMPLE OF 255 HOTEL MANAGERS, HUMAN RESOURCE DIRECTORS, AND OTHER STAFF MEMBERS FROM RAJASTHAN, INDIA, AND THE SMALL-SIZED HOTEL INDUSTRY GAVE DATA USING A STANDARDIZED QUESTIONNAIRE. THE DEVELOPED RESEARCH HYPOTHESES WERE TESTED USING THE STRUCTURAL EQUATION MODELING (SEM) METHOD. FINDINGS - AS PER THE EMPIRICAL RESULTS, ENTREPRENEURIAL ORIENTATION (EO) FACTORS SIGNIFICANTLY IMPACT BUSINESS SUCCESS. THE ABILITY OF THE SERVICE SECTOR TO MARKET ITS PRODUCTS PARTIALLY MEDIATES THE EFFECTS OF ENTREPRENEURIAL ORIENTATION CHARACTERISTICS ON HOTEL INDUSTRY SUCCESS. ORIGINALITY OF THE RESEARCH - THIS RESEARCH WAS CONDUCTED WITH ENTREPRENEURS OF A SINGLE INDUSTRY IN A SPECIFIC COUNTRY USING CROSS-SECTIONAL DATA. THE EXISTING RESEARCH MODEL MAY BE EXTENDED WITH LONGITUDINAL DATA OF OTHER SERVICE SECTORS ESTABLISHED IN DIFFERENT NATIONS. MOREOVER, NEW RESEARCH CONSTRUCTS MAY BE ADDED TO IT FOR FURTHER INVESTIGATION. THE STUDY CONTRIBUTES TO DEVELOPING NATIONS' ENTREPRENEURIAL MARKETING BY EVALUATING THE SIGNIFICANCE OF ENTREPRENEURIAL ATTITUDE IN PREDICTING BUSINESS PERFORMANCE IN EMERGING ECONOMIES. THIS STUDY ALSO SHOWS HOW RESEARCH FINDINGS OF DEVELOPED ECONOMIES CAN BE APPLIED TO EMERGING ECONOMIES.",2025.0,TOURISM AND HOSPITALITY MANAGEMENT-CROATIA,TOUR HOSP MANAG-CROA,10.20867/thm.31.3.6,1.0,True,24456,600156252,0,53,
20,,sap_leaf,100,"LOTFABADI VT, 2024, INTERD J MANAGE STUD",HOW ENTREPRENEURIAL MARKETING LEADS TO CUSTOMER SATISFACTION (THE MEDIATION EFFECT OF CUSTOMER VALUE),"THE CURRENT STUDY AIMS TO DEEPEN THE KNOWLEDGE OF THE DIRECT AND INDIRECT EFFECTS OF ENTREPRENEURIAL MARKETING ON CUSTOMER SATISFACTION THROUGH CUSTOMER VALUE. THE STATISTICAL POPULATION OF THIS STUDY IS FOOD AND AGRICULTURAL PRODUCTS EXPORTING COMPANIES PARTICIPATING IN THE 27TH INTERNATIONAL AGROFOOD EXHIBITION IN TEHRAN 2020. FINALLY, 259 QUESTIONNAIRES CONSIDERING SYSTEMATIC RANDOM SAMPLING METHODS WERE EXPLORED BY STRUCTURAL EQUATION MODELING (SEM) USING SMART PLS3 SOFTWARE. THE RESULT REVEALS THAT ENTREPRENEURIAL MARKETING AFFECTS CUSTOMER SATISFACTION DIRECTLY AND INDIRECTLY THROUGH CUSTOMER VALUE. MOREOVER, INNOVATIVENESS, PROACTIVENESS, RESOURCE LEVERAGE, AND CUSTOMER ORIENTATION INCREASE BOTH CUSTOMER VALUE AND CUSTOMER SATISFACTION POSITIVELY. HOWEVER, THE IMPACT OF RISK-TAKING ON BOTH CUSTOMER VALUE AND CUSTOMER SATISFACTION IS NOT SIGNIFICANT. THIS STUDY CONTRIBUTES TO THE THEORETICAL GROUND OF ENTREPRENEURIAL MARKETING LITERATURE BY PROVIDING THIS KNOWLEDGE THAT WHICH DIMENSIONS MAY AFFECT SATISFACTION DIRECTLY AND INDIRECTLY THROUGH CUSTOMER VALUE.",2024.0,INTERDISCIPLINARY JOURNAL OF MANAGEMENT STUDIES,INTERD J MANAGE STUD,10.22059/ijms.2023.347747.675310,2.0,True,19742,391413146,0,39,
21,,sap_leaf,100,"MARIN A, 2023, J MARKET EDUC","FROM LAB TO MARKET: LEARNING ENTREPRENEURIAL MARKETING THROUGH MULTI-SEMESTER, STAGE-GATE, CAPSTONE PROJECT IN STEM MBA","ENTREPRENEURS BUILD SUCCESSFUL BUSINESSES BY TAKING INNOVATIVE IDEAS FROM RESEARCH LABS TO MARKET. THIS ARTICLE DESCRIBES A PEDAGOGICAL APPROACH AND ITS OUTCOMES IN UTILIZING A MULTI-STAGE, MULTI-COURSE, AND MULTI-SEMESTER CAPSTONE INTEGRATIVE PROJECT TO TEACH ENTREPRENEURIAL MARKETING (EM) OF EARLY-STAGE TECHNOLOGIES. HEREIN WE EXPLAIN CONCEPTS AND PRACTICES THAT ENABLE THE LEARNING NEEDED WITHIN STEM (SCIENCE, TECHNOLOGY, ENGINEERING, MATHEMATICS) MBA PROGRAMS TO COMMERCIALIZE AND MARKET PRODUCTS AND SERVICES ARISING FROM NEW TECHNOLOGIES. THE PEDAGOGY FOLLOWS A FOUR-COURSE SEQUENCE THAT APPLIES STRATEGIC FRAMEWORKS AND TOOLS TO DEVELOP OPPORTUNITY SPACE FOR A PATENTED IDEA, DEVELOP THE IDEA INTO PRODUCT OPTIONS, UNDERTAKE CUSTOMER DISCOVERY, BUILD MARKETING AND SALES STRATEGIES, AND TRANSLATE OPPORTUNITIES INTO VENTURE PLANNING. THESE LAB-TO-MARKET OUTCOMES ARE ACCOMPLISHED BY APPLYING DELIBERATE PRACTICE-BASED ACTION LEARNING METHODS TO BUILD STUDENTS' KNOWLEDGE BASES AND PROBLEM-SOLVING PROCESS SKILLS THAT INCREASE THEIR ENTREPRENEURIAL EXPERTISE. THROUGH LEARNER ENGAGEMENT IN A SEQUENCE OF INNOVATIVE, DATA-DRIVEN, ANALYTICAL PROCESSES THAT FOCUS ON IDENTIFYING, VALIDATING, AND STRATEGIZING AROUND SCALABLE NEW IDEAS, THIS PEDAGOGY ENABLES STUDENTS TO LEARN EM SKILLS THAT CAN BE APPLIED TO DIFFERENT INDUSTRIES AND COMPANIES AT VARIOUS STAGES OF DEVELOPMENT BUT WITH AN EMPHASIS ON EARLY-STAGE TECHNOLOGIES.",2023.0,JOURNAL OF MARKETING EDUCATION,J MARKET EDUC,10.1177/02734753231185415,7.0,True,18056,327538038,0,44,
22,,sap_leaf,100,"TIAN HY, 2025, J COMPETITIVENESS",DATA-DRIVEN DISRUPTIVE COMPETITIVENESS: EXPLORING THE ROLE OF BIG DATA ANALYTICS CAPABILITY AND ENTREPRENEURIAL MARKETING IN DISRUPTIVE INNOVATION,"BIG DATA ANALYTICS CAPABILITY HAS GARNERED SIGNIFICANT ATTENTION IN BOTH ACADEMIC AND MANAGERIAL CIRCLES AS A MAJOR DRIVER OF INNOVATION-DRIVEN COMPETITIVE ADVANTAGE. HOWEVER, THE EXISTING LITERATURE ON THE BDAC-INNOVATION RELATIONSHIP IS STILL INCONCLUSIVE, WITH INDUSTRY REPORTS HIGHLIGHTING THAT MANY FIRMS STRUGGLE TO DERIVE SIGNIFICANT VALUE FROM IT. ROOTED IN RESOURCE-BASED THEORY AND DYNAMIC CAPABILITIES, THIS STUDY EXAMINES THE ROLE OF BIG DATA ANALYTICS CAPABILITY IN DISRUPTIVE INNOVATION, CONSIDERING THE MEDIATION OF ENTREPRENEURIAL MARKETING, A STRATEGIC ORIENTATION REPRESENTING THE INTERFACE OF ENTREPRENEURSHIP AND MARKETING. THE PROPOSED RELATIONSHIPS ARE VALIDATED THROUGH THE ANALYSIS OF 216 MANUFACTURERS IN PAKISTAN USING PARTIAL LEAST SQUARES-BASED STRUCTURAL EQUATION MODELING. THE RESULTS REVEAL THAT BIG DATA ANALYTICS CAPABILITY POSITIVELY INFLUENCES BOTH ENTREPRENEURIAL MARKETING AND DISRUPTIVE INNOVATION, WHILE ENTREPRENEURIAL MARKETING ALSO POSITIVELY INFLUENCES DISRUPTIVE INNOVATION. MOREOVER, ENTREPRENEURIAL MARKETING FULLY MEDIATES THE RELATIONSHIP BETWEEN BIG DATA ANALYTICS CAPABILITY AND DISRUPTIVE INNOVATION. THESE FINDINGS HAVE SIGNIFICANT IMPLICATIONS FOR BOTH THEORY AND PRACTICE.",2025.0,JOURNAL OF COMPETITIVENESS,J COMPETITIVENESS,10.7441/joc.2025.01.12,2.0,True,15242,233605618,0,29,
23,,sap_leaf,100,"SARFRAZ M, 2023, IND TEXTILA",THE EFFECT OF ENTREPRENEURS' PERSONALITY ON ENTREPRENEURIAL MARKETING IN TEXTILE SECTOR: THE MEDIATING ROLE OF SELF-EFFICACY,"THE STUDY OBJECTIVE IS TO ANALYSE THE EFFECT OF BIG-FIVE ENTREPRENEURS' PERSONALITY TRAITS ON ENTREPRENEURIAL MARKETING WHILE CONSIDERING THE MEDIATING ROLE OF SELF-EFFICACY. DATA WERE COLLECTED THROUGH A STRUCTURED QUESTIONNAIRE; A STUDY OF 199 USABLE QUESTIONNAIRES OUT OF 290 WAS CARRIED OUT AMONG YOUNG ENTREPRENEURS. STRUCTURAL EQUATION MODELLING WAS USED TO TEST THE STUDY HYPOTHESIS. THE RESULTS SHOW A SIGNIFICANT RELATIONSHIP BETWEEN PERSONALITY TRAITS AND ENTREPRENEURIAL MARKETING. OPENNESS, EXTROVERSION, AND AGREEABLENESS PERSONALITY TRAITS ARE POSITIVELY LINKED WITH ENTREPRENEURIAL MARKETING. THE FINDINGS ALSO SHOW A POSITIVE ASSOCIATION BETWEEN SELF-EFFICACY AND ENTREPRENEURIAL MARKETING. THE CURRENT STUDY CONTRIBUTES TO THE LITERATURE BY ANALYSING AN ENTREPRENEUR'S PERSONALITY CHARACTERISTICS IN ENTREPRENEURIAL MARKETING.",2023.0,INDUSTRIA TEXTILA,IND TEXTILA,10.35530/IT.074.02.202179,5.0,True,14747,218717480,0,39,
24,,sap_leaf,100,"ROY J, 2025, ARCH TECH SCI",ENTREPRENEURIAL MARKETING AND INNOVATION CAPABILITIES IN HIGH TECHNOLOGY STARTUPS IN EMERGING ECONOMIES,"EMERGING ECONOMIES HAVE A DYNAMIC AND CHALLENGING BUSINESS ENVIRONMENT, WHICH REQUIRES ENTREPRENEURIAL MARKETING AND INNOVATION CAPABILITIES OF THE HIGH-TECH STARTUPS. SUCH STARTUPS ARE USUALLY FACED WITH ISSUES OF LACK OF RESOURCES, REGULATION AND LACK OF PROPER INFRASTRUCTURE. IN THIS REGARD, IT IS IMPORTANT TO COMBINE ENTREPRENEURIAL MARKETING PRACTICES, WHICH INVOLVE RECOGNITION OF OPPORTUNITIES, SENSING OF THE MARKET, INTERACTION WITH CUSTOMERS, AND RISK-TAKING, WITH INNOVATION COMPETENCIES. STARTUPS ARE ABLE TO INTRODUCE NEW SERVICES, PRODUCTS AND SOLUTIONS USING INNOVATION CAPABILITIES, WHICH INCLUDE TECHNOLOGICAL DEVELOPMENT, RESEARCH AND DEVELOPMENT (R&D), KNOWLEDGE MANAGEMENT AND ADAPTIVE LEARNING PROCESSES TO CREATE A COMPETITIVE ADVANTAGE IN THE LONG TERM. THIS PAPER WILL SEEK TO INVESTIGATE THE CONNECTION BETWEEN ENTREPRENEURIAL MARKETING AND INNOVATION CAPABILITIES, HOW THE TWO ELEMENTS CAN BE USED TO MOTIVATE THE PERFORMANCE OF THE HIGH-TECH STARTUPS IN THE EMERGING MARKETS. THE STUDY IS FOUNDED UPON QUANTITATIVE AND QUALITATIVE DATA GATHERING AMONG HIGH-TECH STARTUPS FOUNDERS, CEOS, AND KEY MANAGERS OF 150 STARTUPS LOCATED IN DIFFERENT EMERGING ECONOMIES. THERE WAS THE COLLECTION OF QUANTITATIVE INFORMATION IN THE FORM OF LIKERT SCALE SURVEYS WHICH MEASURED MARKETING PRACTICES IN ENTREPRENEURSHIP, INNOVATION CAPABILITIES AND EXTERNAL INFLUENCES OF GOVERNMENT SUPPORT AND EXTERNAL NETWORKS. SEMI-STRUCTURED INTERVIEWS WERE USED TO ACHIEVE QUALITATIVE DATA TO OBTAIN A MORE INSIGHT INTO THE ROLE PLAYED BY MARKETING STRATEGIES IN FACILITATING INNOVATION AND THE CHALLENGES INVOLVED IN APPLYING THESE STRATEGIES IN A RESOURCE-LIMITED CONTEXT. THE SPSS AND R WERE USED TO CONDUCT STATISTICAL ANALYSIS IN EXAMINING THE RELATIONSHIPS BETWEEN THE VARIABLES. THE RESULTS SHOWED THAT THERE EXISTED STRONG POSITIVE RELATIONSHIPS BETWEEN ENTREPRENEURIAL MARKETING PRACTICES AND INNOVATION CAPABILITIES, AND CUSTOMER ENGAGEMENT HAD THE GREATEST RELATIONSHIP WITH PRODUCT INNOVATION (0.80) AND TECHNOLOGICAL INNOVATION (0.72). THE REGRESSION SHOWED THAT ENTREPRENEURIAL MARKETING IS A SIGNIFICANT PREDICTOR OF INNOVATION PERFORMANCE, WITH MARKET ORIENTATION AND CUSTOMER ENGAGEMENT AS THE MOST IMPORTANT ONES. ALSO, MODERATION ANALYSIS IN SPSS THROUGH THE PROCESS MACRO DEMONSTRATED THAT GOVERNMENT SUPPORT AND EXTERNAL NETWORKS HAD A SIGNIFICANT MODERATING EFFECT ON THE RELATIONSHIP BETWEEN ENTREPRENEURIAL MARKETING AND INNOVATION CAPABILITIES, WHERE EXTERNAL NETWORKS HAD THE HIGHEST MODERATING EFFECT (0.45, P = 0.05). THE RESULTS SUPPORT THE RELEVANCE OF ENTREPRENEURIAL MARKETING AS AN AGENT OF INNOVATION CAPABILITIES IN HIGH-TECH STARTUPS IN EMERGING ECONOMIES.",2025.0,ARCHIVES FOR TECHNICAL SCIENCES,ARCH TECH SCI,10.70102/afts.2025.1834.341,0.0,True,14206,203010454,0,4,
25,,sap_leaf,100,"CORREA V, 2025",THE INFLUENCE OF CAUSAL AND EFFECTUAL ENTREPRENEURSHIP ON THE DIMENSIONS OF ENTREPRENEURIAL MARKETING: AN EXPLORATORY STUDY OF WOMEN ENTREPRENEURS IN BRAZIL,"PURPOSE  ALTHOUGH THE LITERATURE HAS EXAMINED THE RELATIONSHIP BETWEEN ENTREPRENEURSHIP AND ENTREPRENEURIAL MARKETING (EM), THE THEORETICAL INFLUENCE OF THE FOUR DIMENSIONS AND FIVE PRINCIPLES OF CAUSAL AND EFFECTUAL BEHAVIOR ON THE SEVEN DIMENSIONS OF EM REMAINS UNCLEAR. THIS EXPLORATORY STUDY INVESTIGATES HOW THE FOUR CAUSAL ENTREPRENEURSHIP DIMENSIONS AND FIVE EFFECTUAL ENTREPRENEURSHIP PRINCIPLES INFLUENCE THE SEVEN DIMENSIONS OF EM. DESIGN/METHODOLOGY/APPROACH  THIS STUDY EMPLOYS A QUALITATIVE, INTEGRATED, MULTIPLE-CASE STUDY DESIGN. EIGHT BRAZILIAN WOMEN ENTREPRENEURS PARTICIPATED IN THIS STUDY. FINDINGS  WOMEN ENTREPRENEURS LEVERAGE THEIR RESOURCES THROUGH BOTH CAUSAL AND EFFECTUAL BEHAVIORS. HOWEVER, THEY TEND TO INNOVATE AND EXPLORE NEW MARKETS LESS FREQUENTLY. THEIR EFFECTUAL INITIATIVES ARE PARTICULARLY NOTICEABLE IN THEIR PROACTIVE BEHAVIOR. ADDITIONALLY, THERE IS A BALANCED RELATIONSHIP BETWEEN PLANNED AND UNPLANNED PRACTICES WITH RESPECT TO VALUE CREATION AND CUSTOMER ENGAGEMENT. ORIGINALITY/VALUE  THIS STUDY ELUCIDATES THE UNDER-THEORIZED MECHANISMS OF EM BY EXAMINING HOW CAUSAL AND EFFECTUAL BEHAVIORS SHAPE ITS SEVEN DIMENSIONS. IN DOING SO, IT ALLOWS FOR THREE KEY CONTRIBUTIONS TO THE LITERATURE. FIRST, BOTH CAUSAL AND EFFECTUAL BEHAVIORS INFLUENCE EM DIMENSIONS DISTINCTLY, UNDERSCORING THE NEED TO CONSIDER BOTH TYPES FOR A COMPREHENSIVE UNDERSTANDING OF EM. SECOND, THIS STUDY IDENTIFIES WHICH DIMENSIONS OF CAUSAL BEHAVIOR AND WHICH PRINCIPLES OF EFFECTUAL BEHAVIOR MOST STRONGLY AFFECT EACH OF THE SEVEN EM DIMENSIONS, PROVIDING NEW INSIGHTS INTO THEORETICAL AND EMPIRICAL RELATIONSHIPS THAT HAVE NOT YET BEEN EXAMINED. FINALLY, WE PROPOSE FUTURE RESEARCH AGENDAS TO EXPLORE THIS FIELD AND ADDRESS THESE GAPS IN THE LITERATURE.  2026 EMERALD PUBLISHING LIMITED",2025.0,INTERNATIONAL JOURNAL OF GENDER AND ENTREPRENEURSHIP,,10.1108/IJGE-04-2025-0140,0.0,True,13468,182528459,0,30,
26,,sap_leaf,100,"CHEN YH, 2024, SUSTAINABILITY-BASEL",THE INNOVATIVE ENTREPRENEURIAL MARKETING JOURNEY AND SUSTAINABLE DEVELOPMENT OF SOUTHEAST ASIAN IMMIGRANTS,"THE SOUTHEAST ASIAN NEW IMMIGRANTS FACE SIGNIFICANT BARRIERS IN EMPLOYMENT DUE TO LANGUAGE AND CULTURAL DIFFERENCES, MAKING IT CHALLENGING FOR THEM TO FIND JOBS. CONSEQUENTLY, MANY SOUTHEAST ASIAN IMMIGRANTS HAVE TURNED TO ENTREPRENEURSHIP AS A MEANS TO ACHIEVE ECONOMIC INDEPENDENCE AND CONTRIBUTE TO THEIR FAMILY'S INCOME. THIS STUDY ADOPTS ENTREPRENEURIAL MARKETING (EM) AS A THEORETICAL LENS AND UTILIZES A PROCESS RESEARCH METHODOLOGY, BASED ON SEQUENTIALLY ORDERED EVENTS, TO EXPLORE THE ENTREPRENEURIAL JOURNEY OF IMMIGRANT MICRO AND SMALL TO MEDIUM-SIZED ENTERPRISES (SMES). EMPLOYING PURPOSIVE SAMPLING, TWENTY-TWO SOUTHEAST ASIAN IMMIGRANT ENTREPRENEURS WERE SELECTED FOR IN-DEPTH INTERVIEWS TO ENSURE DATA QUALITY THROUGH MULTIPLE DATA COLLECTION METHODS. THE RESEARCH DEVELOPED A DYNAMIC ADJUSTMENT MODEL AND MANAGEMENT MECHANISMS FOR THE ENTREPRENEURIAL MARKETING OF IMMIGRANT MICRO AND SMES. THESE FINDINGS NOT ONLY BRIDGE THEORETICAL GAPS IN IMMIGRANT ENTREPRENEURSHIP STRATEGY BUT ALSO DEEPEN THE ACADEMIC UNDERSTANDING OF THE DYNAMISM IN ENTREPRENEURIAL MARKETING. PRACTICALLY, THE OUTCOMES ASSIST IMMIGRANT MICRO AND SMALL BUSINESS ENTREPRENEURS IN DEVELOPING OPERATIONAL STRATEGIES AND SERVE AS A REFERENCE FOR GOVERNMENTAL UNITS IN CRAFTING IMMIGRANT POLICIES.",2024.0,SUSTAINABILITY,SUSTAINABILITY-BASEL,10.3390/su16072815,3.0,True,13380,180151157,0,42,
27,,sap_leaf,100,"KHASMAFKAN-NEZAM MH, 2025, SOC RESPONSIB J","THE INTERSECTION OF RESPONSIBLE LEADERSHIP AND ENTREPRENEURIAL MARKETING: THE ROLES OF ETHICAL CLIMATE, EFFECTIVE KNOWLEDGE TRANSFER AND PERSON-ORGANIZATION FIT","PURPOSETHIS STUDY AIMS TO EXPLORE HOW RESPONSIBLE LEADERSHIP (RL) DETERMINES THE TYPE AND EFFECTIVENESS OF ENTREPRENEURIAL MARKETING (EM) ACTIVITIES AND IDENTIFY KEY INTRA-ORGANIZATIONAL CAPABILITIES THAT FACILITATE THIS RELATIONSHIP, WHICH MEANS MOVING FROM THE INTRA- TO THE EXTRA-ORGANIZATIONAL ENVIRONMENT. THIS STUDY ALSO EXAMINES THE MODERATING ROLE OF PERSON-ORGANIZATION FIT (P-O FIT) ON THE IMPACT OF ETHICAL CLIMATE (EC) AND EFFECTIVE KNOWLEDGE TRANSFER (EKT) ON EM.DESIGN/METHODOLOGY/APPROACHUSING A CROSS-SECTIONAL SURVEY, DATA WERE COLLECTED FROM 100 SMALL AND MEDIUM-SIZED ENTERPRISES IN IRAN, FOCUSING ON SCIENTIFIC AND RESEARCH SECTORS. STRUCTURAL EQUATION MODELING WAS USED TO ANALYZE THE MEDIATION EFFECTS OF EC AND EKT ON THE RL-EM RELATIONSHIP, ALONGSIDE THE MODERATING INFLUENCE OF P-O FIT.FINDINGSTHE RESULTS OF THIS STUDY DEMONSTRATE THAT RL SIGNIFICANTLY PROMOTES EM, MEDIATED BY AN EC AND EKT. THE RESULTS ALSO CONFIRM THE SIGNIFICANT POSITIVE EFFECT OF EC ON EKT. FURTHERMORE, P-O FIT ENHANCES THE EFFECTS OF BOTH EC AND EKT ON EM, SUGGESTING THAT RL FOSTERS AN ENVIRONMENT CONDUCIVE TO ETHICAL PRACTICES AND KNOWLEDGE SHARING, WHICH IN TURN DRIVES MARKETING INNOVATION.RESEARCH LIMITATIONS/IMPLICATIONSTHE DIVERSITY IN SIZE, RESOURCES AND ORGANIZATIONAL STRUCTURES AMONG SMALL AND MEDIUM-SIZED ENTERPRISES STUDIED MAY ENHANCE THE GENERALIZABILITY OF THE FINDINGS; HOWEVER, IT MAY ALSO COMPLICATE THE CATEGORIZATION OF DATA AND INCREASE THE NUMBER OF OUTLIER DATA POINTS. FUTURE RESEARCH SHOULD EXPLORE VARIOUS INDUSTRIES AND USE LONGITUDINAL DESIGNS TO BETTER UNDERSTAND THE EVOLVING DYNAMICS OF THESE RELATIONSHIPS.PRACTICAL IMPLICATIONSTHIS STUDY SHOWS THAT RL IS CRUCIAL FOR EM, KNOWLEDGE TRANSFER AND A POSITIVE EC. ORGANIZATIONS SHOULD FOCUS ON EMPLOYEES' PERCEPTIONS OF ETHICS AND FOSTER AN ENVIRONMENT THAT PROMOTES COMMITMENT, TRUST, COMMUNICATION AND DEDICATION. THIS APPROACH AIDS KNOWLEDGE TRANSFER, HELPING IDENTIFY MARKET OPPORTUNITIES, INNOVATE CUSTOMER-ORIENTED SOLUTIONS AND CO-CREATE VALUE, ULTIMATELY BOOSTING MARKET SHARE. FURTHERMORE, ALIGNING INDIVIDUALS WITH ORGANIZATIONAL VALUES ENHANCES KNOWLEDGE TRANSFER AND ETHICAL PRACTICES, DRIVING MARKETING INNOVATION AND INCREASING CUSTOMER SATISFACTION.ORIGINALITY/VALUEIN TURBULENT MARKETS, COMPANIES MUST INTRODUCE QUALITY, RELIABLE PRODUCTS. HOWEVER, SHORTENED PRODUCT LIFE CYCLES AND FASTER NEW PRODUCT INTRODUCTIONS CAN LEAD TO SUPPLY FAILURES WITHOUT NEW MARKETING METHODS. THIS RESEARCH AIMS TO IDENTIFY FACTORS INFLUENCING EM AS AN INNOVATIVE APPROACH THROUGH ORGANIZATIONAL CAPABILITIES. THIS STUDY CONTRIBUTES TO THE LITERATURE BY INTEGRATING RL, EC, KNOWLEDGE TRANSFER AND P-O FIT WITHIN THE EM FRAMEWORK, OFFERING INSIGHTS INTO HOW LEADERSHIP CAN SHAPE EFFECTIVE MARKETING STRATEGIES.",2025.0,SOCIAL RESPONSIBILITY JOURNAL,SOC RESPONSIB J,10.1108/SRJ-01-2025-0008,2.0,True,12834,165791051,0,33,
28,,sap_leaf,100,"LI LY, 2023, SUSTAINABILITY-BASEL","SUSTAINABLE MICRO, SMALL, AND MEDIUM ENTERPRISES: A DEVELOPED MODEL OF ENTREPRENEURIAL MARKETING BEHAVIORS FOR THAILAND'S MSMES","THE MAIN OBJECTIVE OF THIS STUDY IS TO PROPOSE A DEVELOPED MODEL OF ENTREPRENEURIAL MARKETING BEHAVIORS FOR SUSTAINABLE MICRO, SMALL, AND MEDIUM ENTERPRISES (MSMES) IN THAILAND. THIS STUDY AIMS TO CONTRIBUTE TO THE EXISTING LITERATURE ON SUSTAINABLE BUSINESS PRACTICES AND ENTREPRENEURIAL MARKETING BEHAVIORS AFTER A DISASTER BY PROVIDING A FRAMEWORK THAT CAN BE USED FOR FUTURE RESEARCH IN THIS AREA, PARTICULARLY AFTER ECONOMIC TURBULENCE. THE RESEARCH METHOD USED IN THIS STUDY IS QUANTITATIVE. THE STUDY WAS CONDUCTED IN BANGKOK, THAILAND. PRIMARY DATA WERE COLLECTED FROM RESPONDENTS VIA A QUESTIONNAIRE USING A NON-PROBABILITY SAMPLING APPROACH (PURPOSIVE SAMPLING). A TOTAL OF 511 OUT OF 600 ISSUED ONLINE AND PAPER SURVEYS WERE SUCCESSFULLY RETURNED, CONSTITUTING AN 85% RESPONSE RATE. THE PRIMARY DATA WERE ACQUIRED FROM FIRST-HAND SOURCES OF THAI MSMES' BUSINESS OWNERS AND MANAGERS. THE HYPOTHESIS TESTING OF THIS STUDY PROVES THAT ENTREPRENEURIAL MARKETING BEHAVIORS COULD INFLUENCE BUSINESS REBOUND DURING THE COVID PERIOD. THE STUDY ALSO CONCLUDES THAT BUSINESS RESILIENCE PRACTICES MEDIATE OR CARRY THE INFLUENCE OF ENTREPRENEURIAL MARKETING BEHAVIORS ON THE BUSINESS REBOUND.",2023.0,SUSTAINABILITY,SUSTAINABILITY-BASEL,10.3390/su151713135,4.0,True,12127,148084865,0,39,
